{
  "answers_format_version": 1,
  "id": "org.weave.character.answers.lumen_reed",
  "pack": {
    "id": "org.weave.character.questionnaire.lantern_choices",
    "version": "1.0.0",
    "sha256": "fef2869f389ed87c880d720fdaf426cadf53bb049b0e7fc14b3eaeda04815dba"
  },
  "responses": {
    "behavior_00": 2,
    "behavior_01": 2,
    "behavior_02": 2,
    "behavior_03": 2,
    "behavior_04": 2,
    "behavior_05": 2,
    "behavior_06": 2,
    "behavior_07": 2,
    "behavior_08": 2,
    "behavior_09": 2,
    "behavior_10": 2,
    "behavior_11": 2,
    "behavior_12": 2,
    "behavior_13": 2,
    "behavior_14": 2,
    "behavior_15": 2,
    "behavior_16": 2,
    "behavior_17": 2,
    "behavior_18": 2,
    "behavior_19": 2,
    "behavior_20": 2,
    "behavior_21": 2,
    "behavior_22": 2,
    "behavior_23": 2
  }
}
